{
  "$schema": "https://json-schema.org/draft/2020-12/schema",
  "$id": "https://research-harness.dev/schema/pack.schema.json",
  "title": "Research Harness Pack (Claude Code plugin)",
  "description": "A pack IS a Claude Code plugin (SPEC §7b): a self-contained bundle of flat skills/, agents/, commands/, and hooks/ under .claude-plugin/plugin.json. This schema validates that plugin.json plus the harness-local fields that classify the pack and namespace its skills.",
  "type": "object",
  "required": ["name", "version", "kind"],
  "additionalProperties": true,
  "properties": {
    "name": {
      "type": "string",
      "pattern": "^[a-z][a-z0-9-]*$",
      "description": "Pack name; also the skill namespace (skills resolve as pack:skill)."
    },
    "version": {
      "type": "string",
      "pattern": "^\\d+\\.\\d+\\.\\d+$"
    },
    "description": { "type": "string" },
    "kind": {
      "type": "string",
      "enum": ["methodology", "genre", "channel", "ontology"],
      "description": "The pack taxonomy (SPEC §7b table): methodology adds dimensions/analyst skills; genre adds deliverable templates; channel adds render adapters; ontology adds MIF entity/relationship/trait extensions."
    },
    "mif": {
      "type": "object",
      "description": "MIF output-conformance declaration (SPEC §10). A channel pack whose target format is orthogonal to MIF (pdf, audio, an external service body) declares exempt:true so the MIF I/O conformance gate skips and logs its outputs instead of requiring a Level-3 projection. Genre packs are L3 by default and MUST NOT declare exemption — exemption is for orthogonal FORMATS, never for genres.",
      "additionalProperties": false,
      "properties": {
        "exempt": {
          "type": "boolean",
          "description": "When true, this pack's rendered outputs are exempt from the MIF Level-3 output-conformance gate."
        },
        "reason": {
          "type": "string",
          "minLength": 1,
          "description": "Why the format is orthogonal to the result (required to make an exemption auditable)."
        }
      },
      "if": {
        "properties": { "exempt": { "const": true } },
        "required": ["exempt"]
      },
      "then": {
        "required": ["reason"]
      }
    },
    "license": { "type": "string" },
    "author": {
      "oneOf": [
        { "type": "string" },
        { "type": "object", "properties": { "name": { "type": "string" } } }
      ]
    },
    "keywords": { "type": "array", "items": { "type": "string" } },
    "provides": {
      "type": "object",
      "description": "What the pack contributes to the core; every entry is namespaced so it never collides with core skills.",
      "additionalProperties": false,
      "properties": {
        "skills": { "type": "array", "items": { "type": "string" } },
        "agents": { "type": "array", "items": { "type": "string" } },
        "commands": { "type": "array", "items": { "type": "string" } },
        "dimensions": { "type": "array", "items": { "type": "string" } },
        "genres": { "type": "array", "items": { "type": "string" } },
        "channels": { "type": "array", "items": { "type": "string" } },
        "ontologies": { "type": "array", "items": { "type": "string" } }
      }
    }
  }
}
