{
  "name": "briefing",
  "version": "0.1.2",
  "kind": "genre",
  "description": "Genre template for a one-page briefing or standup update (what's new, why it matters, what's next)",
  "license": "MIT",
  "author": {
    "name": "zircote"
  },
  "provides": {
    "skills": [
      "briefing"
    ],
    "genres": [
      "briefing"
    ]
  }
}
