{
  "name": "regulatory-review",
  "version": "0.2.0",
  "kind": "methodology",
  "description": "Use when the user asks to \"analyze regulations\", \"regulatory landscape\", \"compliance requirements\", \"legal considerations\", \"regulatory risk\", \"industry regulations\", \"compliance analysis\", \"regulatory trends\", or needs guidance on regulato",
  "license": "MIT",
  "author": {
    "name": "zircote"
  },
  "provides": {
    "skills": [
      "regulatory-review"
    ],
    "dimensions": [
      "regulatory"
    ]
  }
}
