{
  "name": "computing-paper",
  "version": "0.4.2",
  "kind": "genre",
  "description": "Genre template for an ACM/IEEE computing conference or journal paper (Related Work, Approach/System Design, Evaluation, Conclusion & Future Work) with IEEE numbered citations",
  "license": "MIT",
  "author": {
    "name": "zircote"
  },
  "provides": {
    "skills": [
      "computing-paper"
    ],
    "genres": [
      "computing-paper"
    ]
  }
}
