{
  "name": "sustainability-report",
  "version": "0.4.2",
  "kind": "genre",
  "description": "Genre template for a GRI-Standards sustainability/ESG report (GRI 1 Foundation, GRI 2 General Disclosures, GRI 3 Material Topics, topic standards across GRI 200/300/400, and a GRI content index)",
  "license": "MIT",
  "author": {
    "name": "zircote"
  },
  "provides": {
    "skills": [
      "sustainability-report"
    ],
    "genres": [
      "sustainability-report"
    ]
  }
}
