{
  "name": "market-research-report",
  "version": "0.4.2",
  "kind": "genre",
  "description": "Genre template for a full ESOMAR/ISO 20252-style market research report (background, methodology, findings, conclusions/recommendations, technical appendix). The ESOMAR/ICC structure is conventional practice, not a codified format standard.",
  "license": "MIT",
  "author": {
    "name": "zircote"
  },
  "provides": {
    "skills": [
      "market-research-report"
    ],
    "genres": [
      "market-research-report"
    ]
  }
}
