{
  "name": "nist-sp",
  "version": "0.4.2",
  "kind": "genre",
  "description": "Genre template for a NIST Special Publication (SP 800-series) standards/guidance report (authority, abstract, keywords, numbered normative sections, definitions, references, appendices)",
  "license": "MIT",
  "author": {
    "name": "zircote"
  },
  "provides": {
    "skills": [
      "nist-sp"
    ],
    "genres": [
      "nist-sp"
    ]
  }
}
