{
  "name": "systematic-review",
  "version": "0.2.0",
  "kind": "genre",
  "description": "Genre template for a PRISMA 2020 systematic review (structured abstract, methods, results with PRISMA flow diagram, discussion, registration)",
  "license": "MIT",
  "author": {
    "name": "zircote"
  },
  "provides": {
    "skills": [
      "systematic-review"
    ],
    "genres": [
      "systematic-review"
    ]
  }
}
