{
  "name": "security-pentest",
  "version": "0.4.2",
  "kind": "genre",
  "description": "Genre template for a dual-audience PTES penetration-test report: an Executive Summary (background, posture, risk profile, findings, recommendations, strategic roadmap) plus a Technical Report (information gathering, vulnerability assessment, exploitation, post-exploitation, risk/remediation per finding)",
  "license": "MIT",
  "author": {
    "name": "zircote"
  },
  "provides": {
    "skills": [
      "security-pentest"
    ],
    "genres": [
      "security-pentest"
    ]
  }
}
