{
  "name": "clinical-submission",
  "version": "0.2.0",
  "kind": "genre",
  "description": "Genre template for a clinical study report following the ICH E3 CSR skeleton (Synopsis, Ethics, Objectives, Investigational Plan, Methods, Results, Discussion & Conclusions) situated in the CTD five-module frame",
  "license": "MIT",
  "author": {
    "name": "zircote"
  },
  "provides": {
    "skills": [
      "clinical-submission"
    ],
    "genres": [
      "clinical-submission"
    ]
  }
}
