{
  "name": "regulatory-disclosure",
  "version": "0.2.0",
  "kind": "genre",
  "description": "Genre template for an SEC-style annual disclosure report following Regulation S-K / Form 10-K item order (Business, Risk Factors, Properties/Legal, Selected Financial Data, MD&A, Financial Statements, Controls & Procedures)",
  "license": "MIT",
  "author": {
    "name": "zircote"
  },
  "provides": {
    "skills": [
      "regulatory-disclosure"
    ],
    "genres": [
      "regulatory-disclosure"
    ]
  }
}
