{
  "name": "engineering",
  "version": "0.4.2",
  "kind": "genre",
  "description": "Genre template for a design / evaluation report (problem, options, decision, trade-offs, implementation notes)",
  "license": "MIT",
  "author": {
    "name": "zircote"
  },
  "provides": {
    "skills": [
      "engineering"
    ],
    "genres": [
      "engineering"
    ]
  }
}
