{
  "name": "legal-memo",
  "version": "0.4.2",
  "kind": "genre",
  "description": "Genre template for a predictive legal memorandum (Question Presented, Brief Answer, Statement of Facts, IRAC Discussion, Conclusion) with Bluebook practitioner citations",
  "license": "MIT",
  "author": {
    "name": "zircote"
  },
  "provides": {
    "skills": [
      "legal-memo"
    ],
    "genres": [
      "legal-memo"
    ]
  }
}
