{
  "name": "compliance-audit",
  "version": "0.4.2",
  "kind": "genre",
  "description": "Genre template for drafting/modeling a SOC 2 Type II-shaped controls report (auditor's report, management's assertion, system description, Trust Services Criteria, tests of controls & results) — never an attestation",
  "license": "MIT",
  "author": {
    "name": "zircote"
  },
  "provides": {
    "skills": [
      "compliance-audit"
    ],
    "genres": [
      "compliance-audit"
    ]
  }
}
